# Basic CRUD and projection.

statement ok
CREATE TABLE t (id integer PRIMARY KEY, name text, v integer)

statement ok
INSERT INTO t VALUES (1, 'a', 10), (2, 'b', 20), (3, 'c', 30)

query I
SELECT id FROM t WHERE id = 2
----
2

query IT
SELECT id, name FROM t ORDER BY id
----
1
a
2
b
3
c

query I
SELECT v FROM t WHERE name = 'b'
----
20

statement ok
UPDATE t SET v = 99 WHERE id = 1

query I
SELECT v FROM t WHERE id = 1
----
99

statement ok
DELETE FROM t WHERE id = 3

query I
SELECT count(*) FROM t
----
2
